{
  "schema": "axiom-gate-evidence/v1",
  "gate": "merge-regression",
  "suite": "upgrade-journeys",
  "row": "macos-27-arm64",
  "subject": {
    "kind": "prepared",
    "tag": "v9999.0.0-prepared.1",
    "version": "9999.0.0-prepared.1",
    "revision": "9aa63e4316d96303cfbdcc28466043b3b2d15e43",
    "sha256sums_sha256": "0b9fa39066f9918ba7162bccc8cbb17a665dda2919a67cb7db1a302a6750c48c",
    "artifacts": [
      {
        "name": "axiom-9999.0.0-prepared.1-linux-amd64.tar.gz",
        "sha256": "642218ff35fc03c27f85d012bc656085110a8b7e1a6b60e9d2fda871eba24fcb"
      },
      {
        "name": "axiom-9999.0.0-prepared.1-linux-arm64.tar.gz",
        "sha256": "f542f42cf985c629d58013f00c7db26317176714895e78e15dcbbcc348328cf0"
      },
      {
        "name": "axiom-9999.0.0-prepared.1-macos-27-arm64.tar.gz",
        "sha256": "bb7b73661ffb7d48508a4f19644eda2461728f8d3e6a9e8cf79385cac91c251f"
      },
      {
        "name": "axiom-9999.0.0-prepared.1-windows-amd64.tar.gz",
        "sha256": "dcc6a0960b1ceb94b24bef29efbd07b52ca781d4c0b21fda11b479cc16009726"
      }
    ],
    "artifact_id": null,
    "artifact_digest": null
  },
  "run": {
    "attempt_id": "cd621a18-0a76-41e0-bac1-fd4339aa9df6",
    "ci": null
  },
  "environment": {
    "mode": "native",
    "os": {
      "family": "darwin",
      "kernel_release": "27.0.0",
      "distribution": "macos",
      "version": "27.0.1"
    },
    "architecture": "arm64",
    "filesystem": "apfs",
    "runner": null,
    "go_version": "go1.26.1",
    "runtime": {
      "bash": "3.2.57(1)-release",
      "python": "3.14.4",
      "clock_resolution_ms": 1000
    }
  },
  "inputs": {
    "upgrade_sources": [
      {
        "id": "previous-1",
        "kind": "release",
        "version": "0.5.0",
        "tag": null,
        "sha256sums_sha256": "ff93ed162c8a7d1e5cb4691d285d13852477923c4e9f4379982d79f41de107c9",
        "artifacts": [
          {
            "name": "axiom-0.5.0-macos-27-arm64.tar.gz",
            "sha256": "0fb2aa27c645c8bfbf699214f7eb20b60d1f4f3087c437f87a8fc6e2a67716eb"
          }
        ]
      },
      {
        "id": "previous-2",
        "kind": "release",
        "version": "0.1.1",
        "tag": null,
        "sha256sums_sha256": "1b27ca9c0042f51f34cf4166e2074a6a47a72a70afbd77b3e3d5d9d395399701",
        "artifacts": [
          {
            "name": "axiom-0.1.1-macos-27-arm64.tar.gz",
            "sha256": "512bd6bb663c991781345c671efb9c955ec4c9ad0c235086796c71fbee0143a5"
          }
        ]
      },
      {
        "id": "poc-binary",
        "kind": "historical_build",
        "version": null,
        "tag": null,
        "sha256sums_sha256": null,
        "artifacts": [
          {
            "name": "axiom-slice3-poc-lingo",
            "sha256": "a396909b7718c80a42b7a9bcc0a099b243cb9bf2770fd41a80805a553a880111"
          }
        ]
      }
    ],
    "fixtures": [
      {
        "id": "stable-v1-v0.4.0",
        "path": "internal/compatibility/testdata/stable-v1/snapshots/v0.4.0",
        "tree_sha256": "28196fa69f16eedea29c2eaf313ec61b14ee5143eb31e9cbf88018105aff2ba1"
      }
    ],
    "command": [
      "scripts/test-upgrade-journeys.sh",
      "--prepared-set",
      "{candidate}",
      "--row",
      "{subject-row}",
      "--tag",
      "{subject-tag}",
      "--revision",
      "{subject-revision}",
      "--sha256sums-sha256",
      "{subject-sha256sums}",
      "--previous",
      "{previous-1}",
      "--previous",
      "{previous-2}",
      "--poc-binary",
      "{poc-binary}",
      "--evidence",
      "{evidence}"
    ],
    "repository": {
      "revision": "9aa63e4316d96303cfbdcc28466043b3b2d15e43",
      "state": "dirty"
    }
  },
  "journeys": [
    {
      "id": "v1-state",
      "source": {
        "role": "n",
        "path": [
          "previous-1"
        ],
        "generation": null,
        "baseline": null
      },
      "completed": true,
      "result": "pass",
      "reason": null,
      "governing_reference": null,
      "installer": {
        "upgrade": "upgraded",
        "rerun": "unchanged"
      },
      "classification": {
        "before": "valid_v1",
        "after": "valid_v1"
      },
      "preservation_manifest_sha256": null,
      "started_at": "2026-10-06T19:36:37Z",
      "finished_at": "2026-10-06T19:36:42Z",
      "steps": [
        {
          "id": "install-previous",
          "result": "pass",
          "failure_category": null,
          "reason": null,
          "governing_reference": null,
          "duration_ms": 1000
        },
        {
          "id": "first-run-previous",
          "result": "pass",
          "failure_category": null,
          "reason": null,
          "governing_reference": null,
          "duration_ms": 0
        },
        {
          "id": "seed-state-with-previous",
          "result": "pass",
          "failure_category": null,
          "reason": null,
          "governing_reference": null,
          "duration_ms": 1000
        },
        {
          "id": "previous-reads-seeded-state-as-v1",
          "result": "pass",
          "failure_category": null,
          "reason": null,
          "governing_reference": null,
          "duration_ms": 0
        },
        {
          "id": "upgrade",
          "result": "pass",
          "failure_category": null,
          "reason": null,
          "governing_reference": null,
          "duration_ms": 1000
        },
        {
          "id": "upgrade-status",
          "result": "pass",
          "failure_category": null,
          "reason": null,
          "governing_reference": null,
          "duration_ms": 0
        },
        {
          "id": "version",
          "result": "pass",
          "failure_category": null,
          "reason": null,
          "governing_reference": null,
          "duration_ms": 0
        },
        {
          "id": "state-bytes-unchanged",
          "result": "pass",
          "failure_category": null,
          "reason": null,
          "governing_reference": null,
          "duration_ms": 0
        },
        {
          "id": "portable-bytes-unchanged",
          "result": "pass",
          "failure_category": null,
          "reason": null,
          "governing_reference": null,
          "duration_ms": 0
        },
        {
          "id": "state-valid-v1",
          "result": "pass",
          "failure_category": null,
          "reason": null,
          "governing_reference": null,
          "duration_ms": 0
        },
        {
          "id": "project-readable",
          "result": "pass",
          "failure_category": null,
          "reason": null,
          "governing_reference": null,
          "duration_ms": 0
        },
        {
          "id": "execution-readable",
          "result": "pass",
          "failure_category": null,
          "reason": null,
          "governing_reference": null,
          "duration_ms": 0
        },
        {
          "id": "codex-ready",
          "result": "pass",
          "failure_category": null,
          "reason": null,
          "governing_reference": null,
          "duration_ms": 0
        },
        {
          "id": "first-run",
          "result": "pass",
          "failure_category": null,
          "reason": null,
          "governing_reference": null,
          "duration_ms": 0
        },
        {
          "id": "first-run-no-op",
          "result": "pass",
          "failure_category": null,
          "reason": null,
          "governing_reference": null,
          "duration_ms": 0
        },
        {
          "id": "rerun-installer",
          "result": "pass",
          "failure_category": null,
          "reason": null,
          "governing_reference": null,
          "duration_ms": 1000
        },
        {
          "id": "rerun-unchanged",
          "result": "pass",
          "failure_category": null,
          "reason": null,
          "governing_reference": null,
          "duration_ms": 0
        }
      ]
    },
    {
      "id": "skills-1",
      "source": {
        "role": "earlier_release",
        "path": [
          "previous-2"
        ],
        "generation": null,
        "baseline": null
      },
      "completed": true,
      "result": "pass",
      "reason": null,
      "governing_reference": null,
      "installer": {
        "upgrade": "upgraded",
        "rerun": "unchanged"
      },
      "classification": {
        "before": null,
        "after": null
      },
      "preservation_manifest_sha256": null,
      "started_at": "2026-10-06T19:36:42Z",
      "finished_at": "2026-10-06T19:36:45Z",
      "steps": [
        {
          "id": "install-previous",
          "result": "pass",
          "failure_category": null,
          "reason": null,
          "governing_reference": null,
          "duration_ms": 1000
        },
        {
          "id": "first-run-previous",
          "result": "pass",
          "failure_category": null,
          "reason": null,
          "governing_reference": null,
          "duration_ms": 1000
        },
        {
          "id": "upgrade",
          "result": "pass",
          "failure_category": null,
          "reason": null,
          "governing_reference": null,
          "duration_ms": 0
        },
        {
          "id": "upgrade-status",
          "result": "pass",
          "failure_category": null,
          "reason": null,
          "governing_reference": null,
          "duration_ms": 0
        },
        {
          "id": "codex-ready-without-first-run",
          "result": "pass",
          "failure_category": null,
          "reason": null,
          "governing_reference": null,
          "duration_ms": 1000
        },
        {
          "id": "first-run",
          "result": "pass",
          "failure_category": null,
          "reason": null,
          "governing_reference": null,
          "duration_ms": 0
        },
        {
          "id": "claude-ready",
          "result": "pass",